{
  "$schema": "./mapping.schema.json",
  "description": "Korean hospital CSV, one row per encounter, keyed by the hospital patient number (환자ID) with the resident registration number (주민등록번호, RRN) as a second identifier. PIPA: the RRN is HMAC-hashed at import when HMAC_SECRET is set, otherwise masked as ######-******* — a raw RRN never reaches the output. Diagnosis codes are emitted under the WHO ICD-10 URI; KCD-specific extension codes have no registered FHIR URI in FHIRBridge, so review them before exchange. Times are KST (+09:00). patientId.system is a placeholder: KR Core (HL7 Korea) requires Patient.identifier.system but defines no URI for a hospital patient number, so use your hospital's own identifier system URI. Sample data: examples/data/kr-hospital.csv.",
  "patientId": {
    "column": "환자ID",
    "system": "https://fhirbridge.example/identifiers/kr-hospital-mrn"
  },
  "timezone": "+09:00",
  "fields": {
    "Patient.identifier[].value": "주민등록번호",
    "Patient.name.family": "성_Surname",
    "Patient.name.given": "이름_Given",
    "Patient.gender": {
      "column": "성별",
      "transform": "lowercase",
      "valueMap": { "남": "male", "여": "female", "기타": "other" }
    },
    "Patient.birthDate": {
      "column": "생년월일",
      "transform": "date",
      "format": "YYYY-MM-DD"
    },
    "Patient.address.line": "주소_상세",
    "Patient.address.city": "주소_시도",
    "Patient.address.country": { "literal": "KR" },
    "Encounter.period.start": {
      "column": "진료일시",
      "transform": "datetime",
      "format": "YYYY-MM-DD HH:mm"
    },
    "Encounter.class.code": {
      "column": "진료구분",
      "valueMap": { "입원": "IMP", "외래": "AMB" }
    },
    "Condition.code.coding[].system": { "literal": "http://hl7.org/fhir/sid/icd-10" },
    "Condition.code.coding[].code": "진단코드_KCD",
    "Condition.code.text": "진단명",
    "Observation.code.coding[].system": { "literal": "http://loinc.org" },
    "Observation.code.coding[].code": "검사_LOINC",
    "Observation.effectiveDateTime": {
      "column": "진료일시",
      "transform": "datetime",
      "format": "YYYY-MM-DD HH:mm"
    },
    "Observation.valueQuantity.value": "검사_결과",
    "Observation.valueQuantity.unit": "검사_단위"
  },
  "resourceTypes": ["Patient", "Encounter", "Condition", "Observation"]
}
