{
  "$schema": "./mapping.schema.json",
  "description": "Vietnamese hospital CSV, one row per encounter, keyed by the 12-digit citizen ID (CCCD / VNeID number) with WHO ICD-10 diagnosis codes and LOINC lab results. The citizen ID is written as-is to Patient.identifier (it is not hashed at import — FHIRBridge only hashes/masks Korean RRNs there; the optional AI-summary path HMAC-hashes all identifiers). patientId.system is the CCCD identifier system of the HL7 Vietnam VN Core IG (draft, published by Cục Công nghệ thông tin – Bộ Y tế: NamingSystem SID-National-Id); the same IG defines .../sid/insurance_number (BHYT) and .../sid/patient-internal-id (hospital patient number) if your key column is one of those. Times are ICT (+07:00). Sample data: examples/data/vn-hospital.csv.",
  "patientId": {
    "column": "VNEID",
    "system": "http://fhir.ehealth.gov.vn/core/sid/national_id"
  },
  "timezone": "+07:00",
  "fields": {
    "Patient.identifier[].value": "VNEID",
    "Patient.name.family": "HoTen_Surname",
    "Patient.name.given": "HoTen_Given",
    "Patient.gender": {
      "column": "GioiTinh",
      "transform": "lowercase",
      "valueMap": { "Nam": "male", "Nu": "female", "Khac": "other" }
    },
    "Patient.birthDate": {
      "column": "NgaySinh",
      "transform": "date",
      "format": "DD/MM/YYYY"
    },
    "Patient.address.line": "DiaChi_Line",
    "Patient.address.city": "DiaChi_TinhThanh",
    "Patient.address.country": { "literal": "VN" },
    "Encounter.period.start": {
      "column": "NgayKham",
      "transform": "datetime",
      "format": "DD/MM/YYYY HH:mm"
    },
    "Encounter.class.code": {
      "column": "LoaiKham",
      "valueMap": { "NoiTru": "IMP", "NgoaiTru": "AMB" }
    },
    "Condition.code.coding[].system": { "literal": "http://hl7.org/fhir/sid/icd-10" },
    "Condition.code.coding[].code": "ChanDoan_ICD10",
    "Condition.code.text": "ChanDoan_MoTa",
    "Observation.code.coding[].system": { "literal": "http://loinc.org" },
    "Observation.code.coding[].code": "XetNghiem_LOINC",
    "Observation.effectiveDateTime": {
      "column": "NgayKham",
      "transform": "datetime",
      "format": "DD/MM/YYYY HH:mm"
    },
    "Observation.valueQuantity.value": "XetNghiem_KetQua",
    "Observation.valueQuantity.unit": "XetNghiem_DonVi"
  },
  "resourceTypes": ["Patient", "Encounter", "Condition", "Observation"]
}
