{
  "$schema": "./mapping.schema.json",
  "description": "Generic HL7-flavored CSV with MRN / DOB / ICD-10-CM / LOINC columns, one row per encounter. Most US hospital export tools default to a layout near this. VISIT_DATE carries its own UTC offset (format token Z), so no \"timezone\" is needed. Sample data: examples/data/generic-hl7.csv.",
  "patientId": {
    "column": "MRN",
    "system": "urn:oid:2.16.840.1.113883.19.5"
  },
  "fields": {
    "Patient.identifier[].value": "MRN",
    "Patient.name.family": "LAST_NAME",
    "Patient.name.given": "FIRST_NAME",
    "Patient.gender": {
      "column": "GENDER",
      "transform": "lowercase",
      "valueMap": { "M": "male", "F": "female", "O": "other", "U": "unknown" }
    },
    "Patient.birthDate": {
      "column": "DOB",
      "transform": "date",
      "format": "YYYY-MM-DD"
    },
    "Patient.telecom[].system": { "literal": "phone" },
    "Patient.telecom[].value": "PHONE",
    "Encounter.period.start": {
      "column": "VISIT_DATE",
      "transform": "datetime",
      "format": "YYYY-MM-DDTHH:mm:ssZ"
    },
    "Encounter.class.code": "VISIT_CLASS",
    "Condition.code.coding[].system": { "literal": "http://hl7.org/fhir/sid/icd-10-cm" },
    "Condition.code.coding[].code": "ICD10",
    "Condition.code.text": "DIAGNOSIS_TEXT",
    "Observation.code.coding[].system": { "literal": "http://loinc.org" },
    "Observation.code.coding[].code": "LOINC",
    "Observation.effectiveDateTime": {
      "column": "VISIT_DATE",
      "transform": "datetime",
      "format": "YYYY-MM-DDTHH:mm:ssZ"
    },
    "Observation.valueQuantity.value": "RESULT_VALUE",
    "Observation.valueQuantity.unit": "RESULT_UNIT"
  },
  "resourceTypes": ["Patient", "Encounter", "Condition", "Observation"]
}
